<?xml version="1.0" encoding="UTF-8"?>
<dataroot xmlns:od="urn:schemas-microsoft-com:officedata" xmlns:xsi="http://www.w3.org/2001/XMLSchema-instance"  xsi:noNamespaceSchemaLocation="ALUMNO.xsd" generated="2019-05-01T16:01:35">
<ALUMNO>
<DNI>04050022R</DNI>
<NOMBRE>MANUEL</NOMBRE>
<APELLIDOS>ROCA CARRASCO</APELLIDOS>
<POBLACIÓN>MADRID</POBLACIÓN>
<FECHA_x0020_DE_x0020_NACIMIENTO>1980-03-03T00:00:00</FECHA_x0020_DE_x0020_NACIMIENTO>
</ALUMNO>
<ALUMNO>
<DNI>05254558J</DNI>
<NOMBRE>MARÍA</NOMBRE>
<APELLIDOS>MARTIN</APELLIDOS>
<POBLACIÓN>TOLEDO</POBLACIÓN>
<FECHA_x0020_DE_x0020_NACIMIENTO>1965-02-12T00:00:00</FECHA_x0020_DE_x0020_NACIMIENTO>
</ALUMNO>
<ALUMNO>
<DNI>05874422H</DNI>
<NOMBRE>MATÍAS</NOMBRE>
<APELLIDOS>ADÁN PÉREZ</APELLIDOS>
<POBLACIÓN>MADRID</POBLACIÓN>
<FECHA_x0020_DE_x0020_NACIMIENTO>1970-02-08T00:00:00</FECHA_x0020_DE_x0020_NACIMIENTO>
</ALUMNO>
<ALUMNO>
<DNI>05874555H</DNI>
<NOMBRE>PEDRO</NOMBRE>
<APELLIDOS>CALLE HERNÁN</APELLIDOS>
<POBLACIÓN>MADRID</POBLACIÓN>
<FECHA_x0020_DE_x0020_NACIMIENTO>1978-02-10T00:00:00</FECHA_x0020_DE_x0020_NACIMIENTO>
</ALUMNO>
<ALUMNO>
<DNI>05875633H</DNI>
<NOMBRE>MARISA</NOMBRE>
<APELLIDOS>DE LA FUENTE VILLA</APELLIDOS>
<POBLACIÓN>MADRID</POBLACIÓN>
<FECHA_x0020_DE_x0020_NACIMIENTO>1970-05-05T00:00:00</FECHA_x0020_DE_x0020_NACIMIENTO>
</ALUMNO>
<ALUMNO>
<DNI>06874226D</DNI>
<NOMBRE>FERNANDO</NOMBRE>
<APELLIDOS>MARTIN ROJAS</APELLIDOS>
<POBLACIÓN>MADRID</POBLACIÓN>
<FECHA_x0020_DE_x0020_NACIMIENTO>1975-02-02T00:00:00</FECHA_x0020_DE_x0020_NACIMIENTO>
</ALUMNO>
<ALUMNO>
<DNI>21542365L</DNI>
<NOMBRE>JUAN</NOMBRE>
<APELLIDOS>RODA VILLA</APELLIDOS>
<POBLACIÓN>ARAVACA</POBLACIÓN>
<FECHA_x0020_DE_x0020_NACIMIENTO>1970-02-21T00:00:00</FECHA_x0020_DE_x0020_NACIMIENTO>
</ALUMNO>
<ALUMNO>
<DNI>22325501J</DNI>
<NOMBRE>JUAN</NOMBRE>
<APELLIDOS>BLANCO LÓPEZ</APELLIDOS>
<POBLACIÓN>ALCOBENDAS</POBLACIÓN>
<FECHA_x0020_DE_x0020_NACIMIENTO>1975-02-25T00:00:00</FECHA_x0020_DE_x0020_NACIMIENTO>
</ALUMNO>
<ALUMNO>
<DNI>25874123L</DNI>
<NOMBRE>LOURDES</NOMBRE>
<APELLIDOS>VILLA MARTIN</APELLIDOS>
<POBLACIÓN>GETAFE</POBLACIÓN>
<FECHA_x0020_DE_x0020_NACIMIENTO>1970-02-21T00:00:00</FECHA_x0020_DE_x0020_NACIMIENTO>
</ALUMNO>
<ALUMNO>
<DNI>31254878H</DNI>
<NOMBRE>CARMEN</NOMBRE>
<APELLIDOS>MUÑOZ LILLO</APELLIDOS>
<POBLACIÓN>FUENLABRADA</POBLACIÓN>
<FECHA_x0020_DE_x0020_NACIMIENTO>1963-04-25T00:00:00</FECHA_x0020_DE_x0020_NACIMIENTO>
</ALUMNO>
<ALUMNO>
<DNI>34875522F</DNI>
<NOMBRE>MARCOS</NOMBRE>
<APELLIDOS>BLANCO ROJAS</APELLIDOS>
<POBLACIÓN>MADRID</POBLACIÓN>
<FECHA_x0020_DE_x0020_NACIMIENTO>1966-02-02T00:00:00</FECHA_x0020_DE_x0020_NACIMIENTO>
</ALUMNO>
<ALUMNO>
<DNI>35785554L</DNI>
<NOMBRE>RICARDO</NOMBRE>
<APELLIDOS>MEDINA MEDINA</APELLIDOS>
<POBLACIÓN>MÓSTOLES</POBLACIÓN>
<FECHA_x0020_DE_x0020_NACIMIENTO>1971-05-03T00:00:00</FECHA_x0020_DE_x0020_NACIMIENTO>
</ALUMNO>
<ALUMNO>
<DNI>35821455T</DNI>
<NOMBRE>PEDRO</NOMBRE>
<APELLIDOS>RAMÍREZ GALLEGO</APELLIDOS>
<POBLACIÓN>GETAFE</POBLACIÓN>
<FECHA_x0020_DE_x0020_NACIMIENTO>1970-05-26T00:00:00</FECHA_x0020_DE_x0020_NACIMIENTO>
</ALUMNO>
<ALUMNO>
<DNI>35847122S</DNI>
<NOMBRE>MARÍA</NOMBRE>
<APELLIDOS>RUIZ PÉREZ</APELLIDOS>
<POBLACIÓN>MADRID</POBLACIÓN>
<FECHA_x0020_DE_x0020_NACIMIENTO>1956-05-21T00:00:00</FECHA_x0020_DE_x0020_NACIMIENTO>
</ALUMNO>
<ALUMNO>
<DNI>35863332R</DNI>
<NOMBRE>RAQUEL</NOMBRE>
<APELLIDOS>MARTIN PERAL</APELLIDOS>
<POBLACIÓN>MADRID</POBLACIÓN>
<FECHA_x0020_DE_x0020_NACIMIENTO>1975-07-07T00:00:00</FECHA_x0020_DE_x0020_NACIMIENTO>
</ALUMNO>
<ALUMNO>
<DNI>35874225L</DNI>
<NOMBRE>ANTONIO</NOMBRE>
<APELLIDOS>SUÁREZ BLANCO</APELLIDOS>
<POBLACIÓN>MADRID</POBLACIÓN>
<FECHA_x0020_DE_x0020_NACIMIENTO>1969-08-21T00:00:00</FECHA_x0020_DE_x0020_NACIMIENTO>
</ALUMNO>
<ALUMNO>
<DNI>35874586T</DNI>
<NOMBRE>JUAN</NOMBRE>
<APELLIDOS>CALLE LÓPEZ</APELLIDOS>
<POBLACIÓN>VILLALBA</POBLACIÓN>
<FECHA_x0020_DE_x0020_NACIMIENTO>1974-05-15T00:00:00</FECHA_x0020_DE_x0020_NACIMIENTO>
</ALUMNO>
<ALUMNO>
<DNI>35896654E</DNI>
<NOMBRE>CARLOS</NOMBRE>
<APELLIDOS>MORA CRESPO</APELLIDOS>
<POBLACIÓN>VILLALBA</POBLACIÓN>
<FECHA_x0020_DE_x0020_NACIMIENTO>1968-05-25T00:00:00</FECHA_x0020_DE_x0020_NACIMIENTO>
</ALUMNO>
<ALUMNO>
<DNI>35996887P</DNI>
<NOMBRE>ANTONIO</NOMBRE>
<APELLIDOS>MARTIN RECUERO</APELLIDOS>
<POBLACIÓN>MADRID</POBLACIÓN>
<FECHA_x0020_DE_x0020_NACIMIENTO>1959-04-15T00:00:00</FECHA_x0020_DE_x0020_NACIMIENTO>
</ALUMNO>
<ALUMNO>
<DNI>36358741P</DNI>
<NOMBRE>LORENZO</NOMBRE>
<APELLIDOS>PÉREZ BLANCO</APELLIDOS>
<POBLACIÓN>FUENLABRADA</POBLACIÓN>
<FECHA_x0020_DE_x0020_NACIMIENTO>1966-05-26T00:00:00</FECHA_x0020_DE_x0020_NACIMIENTO>
</ALUMNO>
<ALUMNO>
<DNI>36587493G</DNI>
<NOMBRE>ANTONIO</NOMBRE>
<APELLIDOS>MEDINA LÓPEZ</APELLIDOS>
<POBLACIÓN>VILLANUEVA DE LA CAÑADA</POBLACIÓN>
<FECHA_x0020_DE_x0020_NACIMIENTO>1974-06-25T00:00:00</FECHA_x0020_DE_x0020_NACIMIENTO>
</ALUMNO>
<ALUMNO>
<DNI>36874225G</DNI>
<NOMBRE>BENITO</NOMBRE>
<APELLIDOS>PÉREZ MEDINA</APELLIDOS>
<POBLACIÓN>POZUELO</POBLACIÓN>
<FECHA_x0020_DE_x0020_NACIMIENTO>1961-04-25T00:00:00</FECHA_x0020_DE_x0020_NACIMIENTO>
</ALUMNO>
<ALUMNO>
<DNI>37855222J</DNI>
<NOMBRE>ROSA</NOMBRE>
<APELLIDOS>LÓPEZ LILLO</APELLIDOS>
<POBLACIÓN>PARLA</POBLACIÓN>
<FECHA_x0020_DE_x0020_NACIMIENTO>1974-02-02T00:00:00</FECHA_x0020_DE_x0020_NACIMIENTO>
</ALUMNO>
<ALUMNO>
<DNI>38745855J</DNI>
<NOMBRE>MARÍA</NOMBRE>
<APELLIDOS>SÁNCHEZ LILLO</APELLIDOS>
<POBLACIÓN>FUENLABRADA</POBLACIÓN>
<FECHA_x0020_DE_x0020_NACIMIENTO>1966-04-15T00:00:00</FECHA_x0020_DE_x0020_NACIMIENTO>
</ALUMNO>
<ALUMNO>
<DNI>38954777J</DNI>
<NOMBRE>MARTA</NOMBRE>
<APELLIDOS>LÓPEZ MARTIN</APELLIDOS>
<POBLACIÓN>GETAFE</POBLACIÓN>
<FECHA_x0020_DE_x0020_NACIMIENTO>1988-05-15T00:00:00</FECHA_x0020_DE_x0020_NACIMIENTO>
</ALUMNO>
<ALUMNO>
<DNI>38955477R</DNI>
<NOMBRE>Mª ÁNGELES</NOMBRE>
<APELLIDOS>LILLO MARTIN</APELLIDOS>
<POBLACIÓN>PARLA</POBLACIÓN>
<FECHA_x0020_DE_x0020_NACIMIENTO>1964-04-25T00:00:00</FECHA_x0020_DE_x0020_NACIMIENTO>
</ALUMNO>
<ALUMNO>
<DNI>38957236D</DNI>
<NOMBRE>Mª JOSÉ</NOMBRE>
<APELLIDOS>MARTIN VILLANUEVA</APELLIDOS>
<POBLACIÓN>PARLA</POBLACIÓN>
<FECHA_x0020_DE_x0020_NACIMIENTO>1970-05-25T00:00:00</FECHA_x0020_DE_x0020_NACIMIENTO>
</ALUMNO>
<ALUMNO>
<DNI>39718254S</DNI>
<NOMBRE>HÉCTOR</NOMBRE>
<APELLIDOS>MARTIN JIMÉNEZ</APELLIDOS>
<POBLACIÓN>MADRID</POBLACIÓN>
<FECHA_x0020_DE_x0020_NACIMIENTO>1965-07-07T00:00:00</FECHA_x0020_DE_x0020_NACIMIENTO>
</ALUMNO>
<ALUMNO>
<DNI>39854885H</DNI>
<NOMBRE>CELIA</NOMBRE>
<APELLIDOS>DÍAZ RECUERO</APELLIDOS>
<POBLACIÓN>MADRID</POBLACIÓN>
<FECHA_x0020_DE_x0020_NACIMIENTO>1964-07-10T00:00:00</FECHA_x0020_DE_x0020_NACIMIENTO>
</ALUMNO>
</dataroot>
